,Feature Name,Feature Value,Contribution,Average/Mode
1,Size of metadata,180.0,0.14934253012883347,557.5999755859375
0,Total size,3.0,0.06133563438119381,76.05999755859375
11,Number of streams (sequences of binary data),1.0,0.03667503158083491,4.199999809265137
18,Number of Javascript keywords,0.0,-0.03463202250775794,1.0824742268041236
8,Contains text,0.0,0.033886818083019535,0.2911392405063291
7,Number of images,0.0,0.02668269117410091,0.37
3,Number of entries in Xref tables,10.0,0.02424527014701198,3412.030029296875
10,,8.0,0.021485469368399207,15.464646464646465
12,Number of keywords that denote end of streams,1.0,0.02141321398164109,4.232323232323233
9,Number of objects,8.0,0.020582810741416324,15.494949494949495
21,Number of Acroform tags,1.0,0.02007761157724417,0.08080808080808081
4,Number of characters in the title,0.0,0.017852413510290717,7.050000190734863
17,Number of JS keywords,0.0,-0.016516824664468004,0.7419354838709677
15,Number of keywords with startxref,1.0,0.010738643962722562,0.7575757575757576
2,Number of pages,1.0,0.006036984114898587,2.369999885559082
25,Number of XFA keywords,,0.0043926586009911265,-0.05102040816326531
26,Number of unique colors used,0.0,-0.002757824690070265,2.619999885559082
13,Number of Xref tables,1.0,-0.0020874600853858284,0.7373737373737373
20,Number of OpenAction keywords,0.0,-0.001054960201099675,0.3917525773195876
28,Header is standard,True,-0.0007730952108977362,1.0
24,Number of Launch keywords,0.0,-0.00035547619627323,-0.14
6,Number of embedded files,0.0,-0.00025499999697785824,-0.03999999910593033
14,Number of trailers,1.0,0.00022984123303103842,0.7900000214576721
5,Encryption status,0.0,-0.00013333332957699896,-0.07000000029802322
23,Number of RichMedia keywords,0.0,-8.499999064952135e-05,-0.14
19,Number of AA keywords,0.0,6.694446121400687e-05,-0.10204081632653061
16,Number of streams that contain other objects,0.0,2.80952245429944e-05,-0.07000000029802322
22,Presence of JBIG2Decode filter,0.0,-2.1666669636033475e-05,-0.14
27,Header contains error,False,0.0,0.0
