,Feature Name,Feature Value,Contribution,Average/Mode
1,Size of metadata in KB,180.0,0.1280679818954104,557.5999755859375
0,Total size in KB,3.0,0.06951147461081746,76.05999755859375
10,Number of streams (sequences of binary data),1.0,0.042878299201347544,4.199999809265137
11,Number of keywords that denote end of streams,1.0,0.04122710956421542,4.232323232323233
17,Number of Javascript keywords,0.0,-0.03010086769112604,1.0824742268041236
3,Number of entries in Xref tables,10.0,0.029807507083460222,3412.030029296875
8,Contains text,0.0,0.026306713561934883,0.2911392405063291
4,Number of characters in the title,0.0,0.023297579271084033,7.050000190734863
7,Number of images,0.0,0.019491313235294003,0.37
20,Number of Acroform tags,1.0,0.0192342457554696,0.08080808080808081
9,Number of objects,8.0,0.015037507419274334,15.494949494949495
14,Number of keywords with startxref,1.0,0.01196516596456604,0.7575757575757576
16,Number of JS keywords,0.0,-0.011760237465205136,0.7419354838709677
2,Number of pages,1.0,0.007972268978637658,2.369999885559082
24,Number of XFA keywords,,0.006286237378699298,-0.05102040816326531
15,Number of streams that contain other objects,0.0,0.0026836508202177354,-0.07000000029802322
13,Number of trailers,1.0,0.001976904795928931,0.7900000214576721
25,Number of unique colors used,0.0,-0.001663968253224084,2.619999885559082
27,Header is standard,True,-0.0005864285319694318,1.0
12,Number of Xref tables,1.0,0.000306746129244857,0.7373737373737373
21,Presence of JBIG2Decode filter,0.0,-0.00024357142625376583,-0.14
5,Encryption status,0.0,-0.00022166666109114887,-0.07000000029802322
18,Number of AA keywords,0.0,0.0001914285743259825,-0.10204081632653061
6,Number of embedded files,0.0,-0.00018666667194338515,-0.03999999910593033
23,Number of Launch keywords,0.0,-0.00012833332642912863,-0.14
22,Number of RichMedia keywords,0.0,-3.333331784233451e-05,-0.14
19,Number of OpenAction keywords,0.0,-1.706329385342542e-05,0.3917525773195876
26,Header contains error,False,0.0,0.0
